{
  "batch": "DEMO-batch-matrix",
  "cell": "DEMO-C2-pg-async-sync-W5-F06",
  "manifest_sha256": "e483db1467b76c46d1d8775ba3c7c1ee6d9531981724fb1a19a6859e24c33815",
  "provenance": "fixture",
  "results": [
    {
      "clause": "DEMO-clause-durable-ack",
      "evidence": [
        "DEMO-C2-pg-async-sync-W5-F06/0/merged.jsonl#/32",
        "DEMO-C2-pg-async-sync-W5-F06/0/merged.jsonl#/39"
      ],
      "invariant": "DEMO-I1",
      "outcome": "PASS",
      "reason": "Demo data, not a result: written by crashcourt fixtures --demo, not measured.",
      "repro": null,
      "review": null
    },
    {
      "clause": null,
      "evidence": [
        "DEMO-C2-pg-async-sync-W5-F06/0/merged.jsonl#/32",
        "DEMO-C2-pg-async-sync-W5-F06/0/merged.jsonl#/39"
      ],
      "invariant": "DEMO-I5",
      "outcome": "GAP",
      "reason": "Demo data, not a result: written by crashcourt fixtures --demo, not measured.",
      "repro": null,
      "review": null
    },
    {
      "clause": null,
      "evidence": [],
      "invariant": "DEMO-I7",
      "outcome": "NO_ANOMALY_UNSPECIFIED",
      "reason": "Demo data, not a result: written by crashcourt fixtures --demo, not measured.",
      "repro": null,
      "review": null
    }
  ],
  "trial": 0,
  "v": 1
}
