{
  "batch": "DEMO-batch-matrix",
  "cell": "DEMO-pg-async-sync-W1-F08",
  "manifest_sha256": "e483db1467b76c46d1d8775ba3c7c1ee6d9531981724fb1a19a6859e24c33815",
  "provenance": "fixture",
  "results": [
    {
      "clause": "DEMO-clause-durable-ack",
      "evidence": [
        "DEMO-pg-async-sync-W1-F08/0/merged.jsonl#/50",
        "DEMO-pg-async-sync-W1-F08/0/merged.jsonl#/62"
      ],
      "invariant": "DEMO-I1",
      "outcome": "PASS",
      "reason": "Demo data, not a result: written by crashcourt fixtures --demo, not measured.",
      "repro": null,
      "review": null
    },
    {
      "clause": null,
      "evidence": [
        "DEMO-pg-async-sync-W1-F08/0/merged.jsonl#/35",
        "DEMO-pg-async-sync-W1-F08/0/merged.jsonl#/56"
      ],
      "invariant": "DEMO-I5",
      "outcome": "GAP",
      "reason": "Demo data, not a result: written by crashcourt fixtures --demo, not measured.",
      "repro": null,
      "review": null
    },
    {
      "clause": null,
      "evidence": [
        "DEMO-pg-async-sync-W1-F08/0/merged.jsonl#/37",
        "DEMO-pg-async-sync-W1-F08/0/merged.jsonl#/38",
        "DEMO-pg-async-sync-W1-F08/0/merged.jsonl#/62"
      ],
      "invariant": "DEMO-I7",
      "outcome": "GAP",
      "reason": "Demo data, not a result: written by crashcourt fixtures --demo, not measured.",
      "repro": "DEMO-repro-W1-F08-orphaned-effect",
      "review": null
    },
    {
      "clause": null,
      "evidence": [
        "DEMO-pg-async-sync-W1-F08/0/merged.jsonl#/37",
        "DEMO-pg-async-sync-W1-F08/0/merged.jsonl#/56"
      ],
      "invariant": "DEMO-I8",
      "outcome": "GAP",
      "reason": "Demo data, not a result: written by crashcourt fixtures --demo, not measured.",
      "repro": null,
      "review": null
    }
  ],
  "trial": 0,
  "v": 1
}
