{
  "batch": "DEMO-batch-matrix",
  "cell": "DEMO-pg-async-sync-W1-F11",
  "manifest_sha256": "e483db1467b76c46d1d8775ba3c7c1ee6d9531981724fb1a19a6859e24c33815",
  "provenance": "fixture",
  "results": [
    {
      "clause": null,
      "evidence": [],
      "invariant": "DEMO-I1",
      "outcome": "INVALID",
      "reason": "Completeness check failed: DEMO-op-2 has no terminal client event. Demo data, not a result: written by crashcourt fixtures --demo, not measured.",
      "repro": null,
      "review": null
    },
    {
      "clause": null,
      "evidence": [],
      "invariant": "DEMO-I11",
      "outcome": "INVALID",
      "reason": "Completeness check failed: DEMO-op-2 has no terminal client event. Demo data, not a result: written by crashcourt fixtures --demo, not measured.",
      "repro": null,
      "review": null
    }
  ],
  "trial": 1,
  "v": 1
}
